{
  "digest_type": "digest_changelog",
  "source_file": "changelog/unreleased.yaml",
  "source_sha": "1535aadb623a67187dc29ca33384fa97e9882ecb",
  "extractor_version": "1.0.7",
  "extracted_at": 1782386866,
  "payload": {
    "version_label": "unreleased",
    "release_date": "",
    "is_unreleased": true,
    "breaking": [],
    "added": [
      "Added W555 STEP00_SEED_OUT_OF_SCOPE_THIN to seed_lint.py: fires when seeds routed to step \"00\" supply fewer than 3 substantive out-of-scope items combined. The Step 00 charter schema requires out_of_scope minItems:3; without this warning, thin seeds cause authors to hit a gate failure or hallucinate content at authoring time. W555 is warn-only and non-promotable (E555 is the distinct SEMANTIC_COVERAGE_REGRESSION code with different semantics)."
    ],
    "changed": [
      "Relaxed the vc:core:canon JSON Schema entries.minItems constraint from 1 to 0. init_project.py bootstraps spec/canon/manifest.json with entries: [] before any specdev canon-accept has run (Step 03), so the prior minItems: 1 caused spec-check and canonical-integrity to emit E520 schema_invalid on every new project until the canon was populated. New projects legitimately start with an empty project-canon registry.",
      "Extended the changelog format schema (changelog/format.yaml) optional_fields with source_of_truth and render_target, declaring the authoritative YAML source file and its rendered Markdown target. These keys are declared in changelog/format.yaml's optional_fields, so the changelog_parser.py (ChangelogFormat) accepts them as optional top-level keys in versioned changelog files without consuming their values. YAML-to-Markdown parity between the two paths is a manual convention, not tool-enforced."
    ],
    "removed": [],
    "deprecated": [],
    "fixed": [
      "Fixed the generated pre-commit hook configuration for macOS and submodule deployments. All hook entry points are now invoked via devspec_env/bin/python instead of the ambient python, ensuring the managed venv is always used. The validate-all hook has been renamed to spec-check (matching the current CLI command) and updated to pass --spec-root ./spec and --git-root . so project-canon resolution works correctly. The seed-lint, canonical-integrity, and prompt-sync hooks likewise receive --spec-root/--git-root where applicable.",
      "The generated devspec-governance commit-msg hook now sets pass_filenames: true (was false) so pre-commit passes the commit-message file path to governance-check --message, which previously received no message file.",
      "The generated host CI workflow (init_project.py _render_ci_workflow) now runs spec-check spec --repo-root ./devspec_toolkit --spec-root ./spec --git-root . instead of validate-all, so project-canon resolves and new host repositories no longer emit false E110 errors in CI. This mirrors the earlier pre-commit hook fix.",
      "Corrected submodule-deployment documentation and prompt-contract examples to pass the project-canon flags (--spec-root ./spec --git-root .) on spec-validating commands, and switched the CI-gates and scaffold prompt examples to spec-check. Previously these examples used bare invocations that fail to resolve project canon and emit false E110s when followed in a host repo."
    ],
    "section_headers": [],
    "total_entries": 7,
    "has_breaking_changes": false
  }
}